[
  {
    "schema_version": "1.1.0",
    "student_id": "S001",
    "submission_sha256": "111c55e0eb0ab5dccf5bc7c9f4f5872e5954581c37b4025a56d8407f24315356",
    "material_kind": "synthetic",
    "materials_readable": true,
    "source_checks_done": true,
    "deidentified": true,
    "approved_for_feedback": true,
    "previous_feedback_verified": false,
    "reviewer_code": "T000",
    "reviewed_at": "SIMULATED_NOT_A_TEACHER_REVIEW"
  },
  {
    "schema_version": "1.1.0",
    "student_id": "S002",
    "submission_sha256": "29e3d5fba5cde4946391a0420a75f4ac7bdc03fb89eff7c012fd37bf3953a534",
    "material_kind": "synthetic",
    "materials_readable": true,
    "source_checks_done": true,
    "deidentified": true,
    "approved_for_feedback": true,
    "previous_feedback_verified": false,
    "reviewer_code": "T000",
    "reviewed_at": "SIMULATED_NOT_A_TEACHER_REVIEW"
  },
  {
    "schema_version": "1.1.0",
    "student_id": "S003",
    "submission_sha256": "9495cceaf3b6e0a03bfc3ead95d40a6e10cdeac5c9c3ce9d959b3512e16ff0a9",
    "material_kind": "synthetic",
    "materials_readable": true,
    "source_checks_done": true,
    "deidentified": true,
    "approved_for_feedback": true,
    "previous_feedback_verified": false,
    "reviewer_code": "T000",
    "reviewed_at": "SIMULATED_NOT_A_TEACHER_REVIEW"
  },
  {
    "schema_version": "1.1.0",
    "student_id": "S004",
    "submission_sha256": "6da3f7e84532509660bd8eb22e75b3a6122085630752d6e3f2098b945da8c360",
    "material_kind": "synthetic",
    "materials_readable": true,
    "source_checks_done": true,
    "deidentified": true,
    "approved_for_feedback": true,
    "previous_feedback_verified": false,
    "reviewer_code": "T000",
    "reviewed_at": "SIMULATED_NOT_A_TEACHER_REVIEW"
  },
  {
    "schema_version": "1.1.0",
    "student_id": "S005",
    "submission_sha256": "8552e1c6ed3c5d9ab05f34ebd546e70c19816dfccd242f96e36f125a33de80ba",
    "material_kind": "synthetic",
    "materials_readable": true,
    "source_checks_done": true,
    "deidentified": true,
    "approved_for_feedback": true,
    "previous_feedback_verified": false,
    "reviewer_code": "T000",
    "reviewed_at": "SIMULATED_NOT_A_TEACHER_REVIEW"
  },
  {
    "schema_version": "1.1.0",
    "student_id": "S006",
    "submission_sha256": "490117c1af1f26b6158d10883955347f84bafec6704e51bce9a3f63d24adefe1",
    "material_kind": "synthetic",
    "materials_readable": true,
    "source_checks_done": true,
    "deidentified": true,
    "approved_for_feedback": true,
    "previous_feedback_verified": false,
    "reviewer_code": "T000",
    "reviewed_at": "SIMULATED_NOT_A_TEACHER_REVIEW"
  }
]
